{
  "schemaVersion": 1,
  "catalogVersion": 2,
  "updated": "2026-08-23",
  "count": 54,
  "excludedDuplicates": {
    "amen-break-inspired": "Duplikat: die viertaktige Fassung amen-break ist präziser.",
    "funky-drummer-inspired": "Duplikat: funky-drummer nutzt das feinere 16tel-Raster.",
    "purdie-shuffle-original": "Duplikat: half-time-shuffle-purdie bleibt als kanonische Übung.",
    "when-the-levee-breaks-break": "Duplikat: when-the-levee-breaks bleibt als kanonische Übung."
  },
  "review": {
    "basic-rock": {
      "status": "reviewed-existing",
      "originalSourceText": "Loudlands Music: 10 Drum Grooves Every Drummer Needs to Know; Drumeo: Drum Beats Everyone Should Know",
      "notes": "Durch die geprüfte App-Definition ersetzt."
    },
    "four-on-the-floor": {
      "status": "reviewed-existing",
      "originalSourceText": "Loudlands Music: 10 Drum Grooves Every Drummer Needs to Know",
      "notes": "Durch die geprüfte App-Definition ersetzt."
    },
    "basic-shuffle": {
      "status": "style",
      "originalSourceText": "Tactical Drumming: 5 Grooves Every Beginning Drummer Should Know",
      "notes": "Durch die geprüfte App-Definition ersetzt."
    },
    "two-beat-country": {
      "status": "style",
      "originalSourceText": "Tactical Drumming: 5 Grooves Every Beginning Drummer Should Know",
      "notes": "Durch die geprüfte App-Definition ersetzt."
    },
    "basic-swing": {
      "status": "style",
      "originalSourceText": "Tactical Drumming: 5 Grooves Every Beginning Drummer Should Know",
      "notes": "Musikalische Aussage, Raster und Metadaten gegen die angegebene Quelle geprüft und gegebenenfalls korrigiert."
    },
    "reggae-one-drop": {
      "status": "style",
      "originalSourceText": "Drumscore: Basic Reggae Groove; Tunable: Reggae One Drop",
      "notes": "Musikalische Aussage, Raster und Metadaten gegen die angegebene Quelle geprüft und gegebenenfalls korrigiert."
    },
    "six-eight-blues-rock": {
      "status": "style",
      "originalSourceText": "Loudlands Music: 10 Drum Grooves Every Drummer Needs to Know",
      "notes": "Durch die geprüfte App-Definition ersetzt."
    },
    "latin-pop-shakira": {
      "status": "style",
      "originalSourceText": "Tactical Drumming: 5 Grooves Every Beginning Drummer Should Know",
      "notes": "Musikalische Aussage, Raster und Metadaten gegen die angegebene Quelle geprüft und gegebenenfalls korrigiert."
    },
    "samba-basic": {
      "status": "reviewed-existing",
      "originalSourceText": "Bang the Drum School: Develop Samba Independence; sHe druMs: The ONE Samba Drum Beat",
      "notes": "Durch die geprüfte App-Definition ersetzt."
    },
    "bossa-nova": {
      "status": "style",
      "originalSourceText": "Brit.co: How to play a bossa nova groove; Drumscore: Bossa Nova",
      "notes": "Musikalische Aussage, Raster und Metadaten gegen die angegebene Quelle geprüft und gegebenenfalls korrigiert."
    },
    "mambo": {
      "status": "style",
      "originalSourceText": "Drumeo: 5 Latin Grooves Every Drummer Should Know",
      "notes": "Musikalische Aussage, Raster und Metadaten gegen die angegebene Quelle geprüft und gegebenenfalls korrigiert."
    },
    "rosanna-shuffle-inspired": {
      "status": "reduction",
      "originalSourceText": "Bonedo: So spielst du 'Rosanna' von Toto; Francis' Drumming Blog: Rosanna Transcription",
      "notes": "Durch die geprüfte App-Definition ersetzt."
    },
    "fool-in-the-rain-inspired": {
      "status": "reduction",
      "originalSourceText": "Guitar Pro Blog: 5 John Bonham Beats; Drummerforum: Half Time Shuffle",
      "notes": "Durch die geprüfte App-Definition ersetzt."
    },
    "take-five-inspired": {
      "status": "reduction",
      "originalSourceText": "DRUM! Magazine: Joe Morello's 'Take Five' Drum Part; Bonedo: So spielst du 'Take Five'",
      "notes": "Musikalische Aussage, Raster und Metadaten gegen die angegebene Quelle geprüft und gegebenenfalls korrigiert."
    },
    "seven-days-inspired": {
      "status": "reduction",
      "originalSourceText": "Francis' Drumming Blog: Sting – Seven Days Full Drum Transcription",
      "notes": "Musikalische Aussage, Raster und Metadaten gegen die angegebene Quelle geprüft und gegebenenfalls korrigiert."
    },
    "when-the-levee-breaks": {
      "status": "reduction",
      "originalSourceText": "Drumscore: When The Levee Breaks; Drumeo: How To Play 'When The Levee Breaks'",
      "notes": "Musikalische Aussage, Raster und Metadaten gegen die angegebene Quelle geprüft und gegebenenfalls korrigiert."
    },
    "immigrant-song": {
      "status": "reduction",
      "originalSourceText": "Drummercafe: Immigrant Song drum groove",
      "notes": "Musikalische Aussage, Raster und Metadaten gegen die angegebene Quelle geprüft und gegebenenfalls korrigiert."
    },
    "bo-diddley-beat": {
      "status": "style",
      "originalSourceText": "Vic Firth: We Want the Funk! 1955 - Bo Diddley Beat",
      "notes": "Durch die geprüfte App-Definition ersetzt."
    },
    "half-time-shuffle-purdie": {
      "status": "reduction",
      "originalSourceText": "Zoro: The Commandments of the Half-Time Shuffle",
      "notes": "Durch die geprüfte App-Definition ersetzt."
    },
    "new-orleans-second-line": {
      "status": "style",
      "originalSourceText": "Musicians Institute: Essential Groove Series: New Orleans Second Line",
      "notes": "Musikalische Aussage, Raster und Metadaten gegen die angegebene Quelle geprüft und gegebenenfalls korrigiert."
    },
    "linear-funk-garibaldi": {
      "status": "style",
      "originalSourceText": "Roland: Gregg Bissonette 'Linear Funk Drumming'",
      "notes": "Musikalische Aussage, Raster und Metadaten gegen die angegebene Quelle geprüft und gegebenenfalls korrigiert."
    },
    "jazz-waltz": {
      "status": "style",
      "originalSourceText": "Tommy Igoe: Groove Essentials",
      "notes": "Musikalische Aussage, Raster und Metadaten gegen die angegebene Quelle geprüft und gegebenenfalls korrigiert."
    },
    "afrobeat": {
      "status": "style",
      "originalSourceText": "Tommy Igoe: Groove Essentials",
      "notes": "Musikalische Aussage, Raster und Metadaten gegen die angegebene Quelle geprüft und gegebenenfalls korrigiert."
    },
    "heavy-metal-double-bass": {
      "status": "style",
      "originalSourceText": "André Oettel: Groove-Coordination for Drum Set",
      "notes": "Musikalische Aussage, Raster und Metadaten gegen die angegebene Quelle geprüft und gegebenenfalls korrigiert."
    },
    "ska-upbeat": {
      "status": "style",
      "originalSourceText": "Sheet Music Plus: 10 reggae grooves for drums",
      "notes": "Musikalische Aussage, Raster und Metadaten gegen die angegebene Quelle geprüft und gegebenenfalls korrigiert."
    },
    "motown-classic": {
      "status": "style",
      "originalSourceText": "Pat Petrillo: The Roots of Groove: R&B/Soul & Contemporary Funk Styles",
      "notes": "Musikalische Aussage, Raster und Metadaten gegen die angegebene Quelle geprüft und gegebenenfalls korrigiert."
    },
    "fatback": {
      "status": "style",
      "originalSourceText": "Pat Petrillo: The Roots of Groove: R&B/Soul & Contemporary Funk Styles",
      "notes": "Musikalische Aussage, Raster und Metadaten gegen die angegebene Quelle geprüft und gegebenenfalls korrigiert."
    },
    "seven-eight-rock": {
      "status": "reviewed-existing",
      "originalSourceText": "Massimo Russo / Dom Famularo: Odd Feelings",
      "notes": "Durch die geprüfte App-Definition ersetzt."
    },
    "five-four-rock-mission": {
      "status": "style",
      "originalSourceText": "Grooves and More: Folge 35: Odd Meter",
      "notes": "Musikalische Aussage, Raster und Metadaten gegen die angegebene Quelle geprüft und gegebenenfalls korrigiert."
    },
    "cha-cha": {
      "status": "style",
      "originalSourceText": "Tommy Igoe: Groove Essentials",
      "notes": "Musikalische Aussage, Raster und Metadaten gegen die angegebene Quelle geprüft und gegebenenfalls korrigiert."
    },
    "bolero": {
      "status": "style",
      "originalSourceText": "Tommy Igoe: Groove Essentials",
      "notes": "Musikalische Aussage, Raster und Metadaten gegen die angegebene Quelle geprüft und gegebenenfalls korrigiert."
    },
    "tango": {
      "status": "style",
      "originalSourceText": "Tommy Igoe: Groove Essentials",
      "notes": "Musikalische Aussage, Raster und Metadaten gegen die angegebene Quelle geprüft und gegebenenfalls korrigiert."
    },
    "gospel-chop": {
      "status": "style",
      "originalSourceText": "The Daily Drummer: 28 Daily Practice Plans for Drum Set",
      "notes": "Musikalische Aussage, Raster und Metadaten gegen die angegebene Quelle geprüft und gegebenenfalls korrigiert."
    },
    "drum-and-bass-break": {
      "status": "style",
      "originalSourceText": "Bestservice: Drum MIDI Drum Beats",
      "notes": "Musikalische Aussage, Raster und Metadaten gegen die angegebene Quelle geprüft und gegebenenfalls korrigiert."
    },
    "trap-hihat-rolls": {
      "status": "reviewed-existing",
      "originalSourceText": "Joseph Alexander: The Essentials of Hip-Hop Drumming",
      "notes": "Durch die geprüfte App-Definition ersetzt."
    },
    "boom-bap": {
      "status": "reviewed-existing",
      "originalSourceText": "Joseph Alexander: The Essentials of Hip-Hop Drumming",
      "notes": "Durch die geprüfte App-Definition ersetzt."
    },
    "back-in-black-inspired": {
      "status": "reduction",
      "originalSourceText": "Hudson Music: Classic Rock Groove Pack 1",
      "notes": "Musikalische Aussage, Raster und Metadaten gegen die angegebene Quelle geprüft und gegebenenfalls korrigiert."
    },
    "good-times-bad-times-inspired": {
      "status": "reduction",
      "originalSourceText": "Drumeo: Brian Tichy: 5 Bonham Licks Every Drummer Must Know",